{
  "schema_version": 2,
  "document": "editorial",
  "sqid": "sq9719026",
  "policy_refs": [
    "G1",
    "G2"
  ],
  "context_markdown": "This public register records known, intentional differences between the supplied printed source and the current edition. The choices are adopted for this edition; they do not purport to recover the original transcriber’s intentions.\n\nAll 18 pages of the source and all four staves received a page/system comparison, with magnified checks of identified passages and native score inspection. This is not an independent second note-by-note transcription or a collation of all surviving sources. The supplied source is the Breitkopf & Härtel collected edition reprinted by Dover, not an autograph.\n\n**Numbering:** the quartet has four musical movements. The catalogue’s five-section record is copied unchanged in the metadata. Movement IV contains La Malinconia (*Adagio*, bars 1–44) and the ensuing *Allegretto*, whose native bar numbering restarts at a pickup and continues 1–252. Entries explicitly name the section and sort Adagio before Allegretto. Movement III uses the native continuous Scherzo/Trio numbering; its pickups and alternate endings are identified where necessary.",
  "records": [
    {
      "id": "ED-001",
      "movement": 1,
      "movement_label": "I",
      "section_order": 0,
      "section": "",
      "measure_start": 60,
      "measure_end": 60,
      "location": "60",
      "part": "All parts",
      "type": "Expression text",
      "status": "accepted",
      "summary": "Source decresc. rendered as dim.",
      "physical_measure": 60,
      "source_page": 2,
      "edition_page": 2,
      "title": "ED-001 — Equivalent diminuendo wording",
      "body_markdown": "**Source:** decresc.\n\n**Edition:** dim.\n\n**Editorial reason:** Retain the synonymous abbreviation for the same gradual decrease in dynamic, at the source location.",
      "images": [
        {
          "role": "source",
          "path": "images/ed-001-source.png",
          "caption": "Source scan; PDF p.2, system 4. Complete system excerpt; locate the bar specified above.",
          "pdf_page": 2
        },
        {
          "role": "edition",
          "path": "images/ed-001-edition.png",
          "caption": "Current edition, native MuseScore render; PDF p.2, system 4. Complete system excerpt; locate the bar specified above.",
          "pdf_page": 2
        }
      ],
      "policy_refs": [],
      "policy_review": {
        "status": "clarification_needed",
        "note": "Imported decision; its guideline references require review. The musical decision has not been changed.",
        "proposal_ids": []
      }
    },
    {
      "id": "ED-002",
      "movement": 1,
      "movement_label": "I",
      "section_order": 0,
      "section": "",
      "measure_start": 170,
      "measure_end": 170,
      "location": "170",
      "part": "All parts",
      "type": "Expression text",
      "status": "accepted",
      "summary": "Source decresc. rendered as dim.",
      "physical_measure": 171,
      "source_page": 5,
      "edition_page": 5,
      "title": "ED-002 — Equivalent diminuendo wording",
      "body_markdown": "**Source:** decresc.\n\n**Edition:** dim.\n\n**Editorial reason:** Retain the synonymous abbreviation for the same gradual decrease in dynamic, at the source location.",
      "images": [
        {
          "role": "source",
          "path": "images/ed-002-source.png",
          "caption": "Source scan; PDF p.5, system 2. Complete system excerpt; locate the bar specified above.",
          "pdf_page": 5
        },
        {
          "role": "edition",
          "path": "images/ed-002-edition.png",
          "caption": "Current edition, native MuseScore render; PDF p.5, system 2. Complete system excerpt; locate the bar specified above.",
          "pdf_page": 5
        }
      ],
      "policy_refs": [],
      "policy_review": {
        "status": "clarification_needed",
        "note": "Imported decision; its guideline references require review. The musical decision has not been changed.",
        "proposal_ids": []
      }
    },
    {
      "id": "ED-003",
      "movement": 1,
      "movement_label": "I",
      "section_order": 0,
      "section": "",
      "measure_start": 233,
      "measure_end": 233,
      "location": "233",
      "part": "All parts",
      "type": "Expression text",
      "status": "accepted",
      "summary": "Source decresc. rendered as dim.",
      "physical_measure": 234,
      "source_page": 6,
      "edition_page": 7,
      "title": "ED-003 — Equivalent diminuendo wording",
      "body_markdown": "**Source:** decresc.\n\n**Edition:** dim.\n\n**Editorial reason:** Retain the synonymous abbreviation for the same gradual decrease in dynamic, at the source location.",
      "images": [
        {
          "role": "source",
          "path": "images/ed-003-source.png",
          "caption": "Source scan; PDF p.6, system 5. Complete system excerpt; locate the bar specified above.",
          "pdf_page": 6
        },
        {
          "role": "edition",
          "path": "images/ed-003-edition.png",
          "caption": "Current edition, native MuseScore render; PDF p.7, system 1. Complete system excerpt; locate the bar specified above.",
          "pdf_page": 7
        }
      ],
      "policy_refs": [],
      "policy_review": {
        "status": "clarification_needed",
        "note": "Imported decision; its guideline references require review. The musical decision has not been changed.",
        "proposal_ids": []
      }
    },
    {
      "id": "ED-004",
      "movement": 2,
      "movement_label": "II",
      "section_order": 0,
      "section": "",
      "measure_start": 27,
      "measure_end": 27,
      "location": "27",
      "part": "All parts",
      "type": "Expression text",
      "status": "accepted",
      "summary": "Source decresc. rendered as dim.",
      "physical_measure": 293,
      "source_page": 8,
      "edition_page": 9,
      "title": "ED-004 — Equivalent diminuendo wording",
      "body_markdown": "**Source:** decresc.\n\n**Edition:** dim.\n\n**Editorial reason:** Retain the synonymous abbreviation for the same gradual decrease in dynamic, at the source location.",
      "images": [
        {
          "role": "source",
          "path": "images/ed-004-source.png",
          "caption": "Source scan; PDF p.8, system 4. Complete system excerpt; locate the bar specified above.",
          "pdf_page": 8
        },
        {
          "role": "edition",
          "path": "images/ed-004-edition.png",
          "caption": "Current edition, native MuseScore render; PDF p.9, system 2. Complete system excerpt; locate the bar specified above.",
          "pdf_page": 9
        }
      ],
      "policy_refs": [],
      "policy_review": {
        "status": "clarification_needed",
        "note": "Imported decision; its guideline references require review. The musical decision has not been changed.",
        "proposal_ids": []
      }
    },
    {
      "id": "ED-005",
      "movement": 2,
      "movement_label": "II",
      "section_order": 0,
      "section": "",
      "measure_start": 37,
      "measure_end": 37,
      "location": "37",
      "part": "Cello",
      "type": "Clef",
      "status": "accepted",
      "summary": "Tenor clef for the short upper passage, returning to bass within the same bar.",
      "physical_measure": 303,
      "source_page": 9,
      "edition_page": 10,
      "title": "ED-005 — Modern cello clef",
      "body_markdown": "**Source:** Historical treble clef, read an octave below its literal written register, within II.37.\n\n**Edition:** Tenor clef for the short upper passage, returning to bass within the same bar.\n\n**Editorial reason:** Modern clefs make the sounding octave unambiguous. Sounding pitches and the position of the return to bass are preserved.",
      "images": [
        {
          "role": "source",
          "path": "images/ed-005-source.png",
          "caption": "Source scan; PDF p.9, system 2. Complete system excerpt; locate the bar specified above.",
          "pdf_page": 9
        },
        {
          "role": "edition",
          "path": "images/ed-005-edition.png",
          "caption": "Current edition, native MuseScore render; PDF p.10, system 1. Complete system excerpt; locate the bar specified above.",
          "pdf_page": 10
        }
      ],
      "policy_refs": [],
      "policy_review": {
        "status": "clarification_needed",
        "note": "Imported decision; its guideline references require review. The musical decision has not been changed.",
        "proposal_ids": []
      }
    },
    {
      "id": "ED-006",
      "movement": 3,
      "movement_label": "III",
      "section_order": 0,
      "section": "",
      "measure_start": 48,
      "measure_end": 48,
      "location": "48",
      "part": "All parts / navigation",
      "type": "Navigation",
      "status": "accepted",
      "summary": "Fine supplied at the Scherzo endpoint, m.48.",
      "physical_measure": 396,
      "source_page": 12,
      "edition_page": 13,
      "title": "ED-006 — Fine supplied",
      "body_markdown": "**Source:** The Scherzo close has no Fine; the Trio ending directs Scherzo D.C.\n\n**Edition:** Fine supplied at the Scherzo endpoint, m.48.\n\n**Editorial reason:** Clarifies the endpoint of the da-capo return. The choice is adopted for the current edition; a complete playback audition is not claimed.",
      "images": [
        {
          "role": "source",
          "path": "images/ed-006-source.png",
          "caption": "Source scan; PDF p.12, system 1. Complete system excerpt; locate the bar specified above.",
          "pdf_page": 12
        },
        {
          "role": "edition",
          "path": "images/ed-006-edition.png",
          "caption": "Current edition, native MuseScore render; PDF p.13, system 2. Complete system excerpt; locate the bar specified above.",